Start Time,End Time,Subtitle
01:38:44:22,01:38:49:04,"Well, it needs it now more than ever, but you betrayed everything you stood for."
01:38:51:02,01:38:56:18,There's a point far out there when the structures fail you...
01:38:56:22,01:38:59:19,...when the rules aren't weapons any more...
01:39:00:12,01:39:03:23,"...they're shackles, letting the bad guy get ahead."
01:39:05:15,01:39:09:01,"One day, you may face..."
01:39:09:05,01:39:10:21,...such a moment of crisis.
01:39:11:01,01:39:14:08,"And in that moment, I hope you have a friend like I did..."
01:39:15:00,01:39:20:04,"...to plunge their hands into the filth, so that you can keep yours clean!"
01:39:21:17,01:39:24:09,"Your hands look plenty filthy to me, commissioner."
01:39:26:00,01:39:29:12,We take Gotham from the corrupt!
01:39:31:20,01:39:32:22,The rich!
01:39:33:20,01:39:35:19,The oppressors of generations...
01:39:35:23,01:39:40:03,...who have kept you down with myths of opportunity.
01:39:40:07,01:39:43:08,And we give it back to you...
01:39:43:23,01:39:46:04,...the people.
01:39:47:06,01:39:49:04,Gotham is yours!
01:39:49:15,01:39:52:23,None shall interfere. Do as you please.
01:39:55:05,01:39:58:17,But start by storming Blackgate and freeing the oppressed!
01:39:58:21,01:40:00:14,Open it!
01:40:08:12,01:40:11:14,"Step forward, those who would serve..."
01:40:13:04,01:40:14:22,...for an army will be raised.
01:40:19:04,01:40:23:18,The powerful will be ripped from their decadent nests...
01:40:28:11,01:40:33:23,...and cast out into the cold world that we know and endure!
01:40:38:13,01:40:40:15,Courts will be convened.
01:40:48:07,01:40:50:15,Spoils will be enjoyed.
01:40:55:10,01:40:57:01,Blood will be shed!
01:41:00:09,01:41:03:01,The police will survive...
01:41:03:05,01:41:07:15,...as they learn to serve true justice.
01:41:08:18,01:41:11:06,This great city...
01:41:13:10,01:41:14:22,...it will endure.
01:41:17:15,01:41:21:09,Gotham will survive!
01:41:24:21,01:41:27:14,
01:41:35:14,01:41:36:18,
01:41:39:12,01:41:43:01,
01:41:43:05,01:41:45:15,He says you must first fix your back.
01:41:45:21,01:41:46:24,How does he know?
01:41:47:04,01:41:48:14,He was the prison doctor.
01:41:48:18,01:41:52:15,He's a morphine addict who incurred the displeasure...
01:41:52:19,01:41:56:17,"...of powerful people, including your masked friend."
01:41:57:15,01:41:59:03,How?
01:42:00:09,01:42:04:16,"Many years ago, it was a time of plague."
01:42:06:06,01:42:09:09,Some of the other prisoners attacked Bane.
01:42:11:09,01:42:15:02,The doctor's fumbling attempts to repair the damage...
01:42:15:20,01:42:17:12,...left him in perpetual agony.
01:42:17:15,01:42:20:20,The mask holds the pain at bay.
01:42:20:24,01:42:24:08,Bane was the child you spoke of?
01:42:24:12,01:42:25:19,He was born here?
01:42:26:18,01:42:31:05,The legend is that there was a mercenary who worked for a local warlord.
01:42:31:23,01:42:34:07,He fell in love with the warlord's daughter.
01:42:34:19,01:42:36:09,They were married in secret.
01:42:36:13,01:42:38:13,When the warlord found out...
01:42:39:01,01:42:42:21,...the mercenary was condemned to this pit.
01:42:43:11,01:42:45:17,But then he exiled him instead.
01:42:45:21,01:42:49:22,The mercenary understood that it was the daughter who had secured his release.
01:42:50:02,01:42:54:23,But what he could not know was the true price of his freedom.
01:42:56:00,01:42:57:20,She took his place in the pit.
01:43:00:23,01:43:02:12,And she was with child...
01:43:02:16,01:43:04:14,...the mercenary's child.
01:43:07:04,01:43:10:09,Innocence cannot flower underground. It has to be stamped out.
01:43:12:24,01:43:18:23,"One day, the doctor forgot to lock the cell."
01:43:25:17,01:43:28:01,But the child had a friend...
01:43:28:12,01:43:33:24,...a protector who showed the others that this innocence was their redemption.
01:43:34:03,01:43:35:21,It was to be prized.
01:43:36:00,01:43:37:18,The mother was not so lucky.
01:43:38:08,01:43:40:02,
01:43:40:22,01:43:44:15,This is Bane's prison now. He wouldn't want this story told.
01:43:47:04,01:43:49:05,
01:43:55:24,01:43:59:17,There's a vertebra protruding from your back.
01:44:00:02,01:44:02:04,It has to be put back.
01:44:02:23,01:44:04:22,
01:44:07:04,01:44:09:23,Stay like this until you stand.
01:44:17:06,01:44:22:22,"Tsk, tsk, tsk. Did you not think I would return, Bruce? Hmm?"
01:44:23:14,01:44:25:05,
01:44:28:14,01:44:30:05,I told you I was immortal.
01:44:32:18,01:44:34:21,I watched... I watched you die.
01:44:35:01,01:44:38:00,"Oh, there are many forms of immortality."
01:44:39:22,01:44:41:09,"Once, I had a wife..."
01:44:42:22,01:44:44:15,...my great love.
01:44:46:00,01:44:49:09,#NAME?
01:44:53:10,01:44:55:09,Bane is your child.
01:44:57:00,01:44:58:01,Your heir.
01:44:58:05,01:45:00:23,An heir to ensure the League of Shadows fulfills its duty...
01:45:01:03,01:45:03:18,...to restore balance to civilization.
01:45:03:22,01:45:04:24,No.
01:45:05:04,01:45:08:14,You yourself fought the decadence of Gotham for years...
01:45:08:18,01:45:10:16,...with all your strength...
01:45:11:01,01:45:15:06,"...all your resources, all your moral authority."
01:45:15:24,01:45:18:24,And the only victory you could achieve was a lie.
01:45:19:15,01:45:22:12,Now you understand. Gotham is beyond saving.
01:45:22:16,01:45:23:19,No.
01:45:23:23,01:45:26:02,- And must be allowed to die. - No!
01:45:33:00,01:45:35:00,"Yeah, just lift your head."
01:45:35:10,01:45:36:20,"Oh, that's good."
01:45:42:16,01:45:43:18,"No, no!"
01:46:19:02,01:46:21:11,- What's that? - This was someone's home.
01:46:21:14,01:46:23:12,And now it's everyone's home.
01:46:25:07,01:46:28:09,"There's a storm coming, remember? This is what you wanted."
01:46:52:18,01:46:54:23,
01:46:57:11,01:47:00:06,"It's for the bus, in case there's a chance to evacuate."
01:47:00:10,01:47:01:23,Any news? Is the commissioner...?
01:47:02:03,01:47:05:12,"The less you know, Father. How are the boys doing?"
01:47:05:15,01:47:08:11,"Well, we've had more power on so they've got some TV."
01:47:08:14,01:47:09:23,It's good to see you.
01:47:10:16,01:47:14:17,"Blake, you be careful out there. They're hunting down cops like dogs."
01:47:20:10,01:47:21:17,Why build yourself?
01:47:24:01,01:47:29:00,"- I'm not meant to die in here. - Here, there. What's the difference?"
01:47:36:05,01:47:38:14,
01:48:13:22,01:48:15:15,
01:48:30:17,01:48:34:02,I told you it could not be done.
01:48:34:06,01:48:35:21,You told me a child did it.
01:48:36:01,01:48:37:02,
01:48:37:06,01:48:39:13,But no ordinary child.
01:48:39:17,01:48:42:12,A child born in hell.
01:48:46:20,01:48:48:07,Forged from suffering.
01:48:50:10,01:48:52:17,Hardened by pain.
01:48:54:06,01:48:56:21,Not a man from privilege.
01:49:15:23,01:49:17:22,"We got boots on the ground, sir."
01:49:18:17,01:49:19:19,Just waiting on intel.
01:49:25:12,01:49:26:13,You have ID?
01:49:27:06,01:49:28:07,Of course not.
01:49:28:11,01:49:31:00,"- Well, how can we trust you? - We don't have any choice."
01:49:31:21,01:49:34:05,"Commissioner Gordon. Captain Jones, Special Forces."
01:49:34:09,01:49:35:22,Captain. Glad to have you here.
01:49:36:02,01:49:38:18,"It's our job, sir. Now, uh, how many of you are there?"
01:49:38:22,01:49:41:20,"Well, there's dozens. I'd rather not say exactly."
01:49:42:00,01:49:45:06,But the men trapped underground number almost 3000.
01:49:45:10,01:49:47:08,#NAME?
01:49:47:12,01:49:49:19,#NAME?
01:49:49:23,01:49:52:08,Take out the mercenaries south of Ackerman Park.
01:49:52:11,01:49:55:05,"Blow the rubble, make a hole big enough for 10 at a time."
01:49:55:08,01:49:58:14,I'm in contact with my partner who's down there. They're just waiting.
01:49:58:18,01:50:02:24,- Men who haven't seen daylight in months? - Officers who haven't seen daylight in months.
01:50:03:04,01:50:05:20,What about the bomb? Satellite can't pick up radiation hot spots.
01:50:06:09,01:50:09:18,They keep it on a truck. It must have a lead-lined roof.
01:50:09:22,01:50:12:14,#NAME?
01:50:12:18,01:50:16:02,"Well, it's one of three. We've been tracking it."
01:50:16:11,01:50:17:12,Decoy.
01:50:19:01,01:50:22:11,- You don't really think he's coming back? - Doesn't matter what I think.
01:50:22:15,01:50:26:12,"Actually, it does. You should put your faith in something a little more real."
01:50:26:16,01:50:29:21,- The routes don't vary much - Okay. What about the triggerman?
01:50:30:01,01:50:34:03,No leads. It's a bluff. Bane wouldn't give control of that bomb to someone else.
01:50:34:06,01:50:38:12,"We can't take that chance. Until we have the triggerman, we just track the device."
01:50:38:16,01:50:42:14,"And meanwhile, Gotham lives under a warlord, like some failed state?"
01:50:42:18,01:50:45:15,"Dial it back, officer. This situation is unprecedented."
01:50:45:19,01:50:51:01,- We can't do anything to risk millions of lives. - You gonna tell him what's really going on?
01:50:51:05,01:50:54:07,"Captain, the situation is more complicated than you think."
01:50:54:11,01:50:56:16,There's someone you need to meet.
01:50:56:24,01:51:00:21,Came upstairs looking for a vantage point. Found the people who run the corporation.
01:51:01:01,01:51:02:05,What corporation?
01:51:02:09,01:51:04:18,Wayne Enterprises. You good?
01:51:13:19,01:51:15:24,"Mr. Fox, would you like to brief the captain?"
01:51:16:04,01:51:18:19,Miss Tate's fully aware of the situation.
01:51:18:22,01:51:23:10,"And as CEO of Wayne Enterprises, I have to take responsibility for it."
01:51:23:14,01:51:25:14,#NAME?
01:51:25:18,01:51:27:06,You built the bomb?
01:51:27:10,01:51:31:14,It was built as a fusion reactor. First of its kind.
01:51:31:18,01:51:35:03,Bane turned the core into a bomb and removed it from the reactor.
01:51:35:07,01:51:38:16,- Here's the important part. - As the device's fuel cells deteriorate...
01:51:38:20,01:51:40:18,...it becomes increasingly unstable...
01:51:40:22,01:51:42:11,...to the point of detonation.
01:51:42:15,01:51:44:09,This bomb is a time bomb.
01:51:44:13,01:51:48:13,"And it will go off in 23 days, regardless of Bane's revolution..."
01:51:48:17,01:51:51:10,"...or what we, or the outside world, choose to do."
01:51:51:14,01:51:54:05,So your plan might not be as practical as you thought.
01:51:54:17,01:51:59:05,#NAME?
01:51:59:08,01:52:02:12,- Let's move from this location and call it in. - Right. Let's go.
01:52:02:16,01:52:05:21,"No, no, we'll take it from here. You stay and look after these folks."
01:52:08:12,01:52:10:05,
01:52:10:09,01:52:11:20,
01:52:13:05,01:52:14:11,Someone sold us out.
01:52:16:02,01:52:17:13,"Go, go, go!"
01:52:38:20,01:52:40:23,I'll die before I talk.
01:52:41:15,01:52:43:22,"I'm on your schedule, captain."
01:52:44:02,01:52:45:17,
01:52:50:09,01:52:52:17,There were people living upstairs.
01:52:53:05,01:52:55:08,Round them up forjudgment...
01:52:59:04,01:53:04:01,...and hang them where the world can see.
01:53:06:02,01:53:10:21,Police have cordoned off the entire Central Heights and East Park Side areas...
01:53:11:01,01:53:15:03,...as well as Merchant and South Shoreline Boulevards in an attempt...
01:53:16:15,01:53:18:15,
01:53:18:18,01:53:22:20,He says the leap to freedom is not about strength.
01:53:23:06,01:53:25:06,My body makes the jump.
01:53:25:18,01:53:29:15,Survival is the spirit. The soul.
01:53:32:13,01:53:35:12,My soul is as ready to escape as my body.
01:53:35:16,01:53:38:16,Fear is why you fail.
01:53:38:23,01:53:40:12,"No, I'm not afraid."
01:53:42:04,01:53:43:16,I'm angry.
01:53:46:05,01:53:48:04,
01:54:04:05,01:54:05:20,
01:54:12:22,01:54:14:09,Bruce.
01:54:15:14,01:54:16:16,Why do we fall?
01:54:16:24,01:54:18:22,
01:54:22:17,01:54:24:14,You do not fear death.
01:54:25:15,01:54:30:04,You think this makes you strong. It makes you weak.
01:54:30:17,01:54:31:18,Why?
01:54:31:22,01:54:34:04,How can you move faster than possible...
01:54:34:11,01:54:36:22,...fight longer than possible...
01:54:37:05,01:54:40:19,...without the most powerful impulse of the spirit?
01:54:42:01,01:54:43:16,The fear of death.
01:54:44:09,01:54:46:06,I do fear death.
01:54:48:02,01:54:50:01,I fear dying in here...
01:54:50:20,01:54:52:18,...while my city burns.
01:54:53:19,01:54:55:17,There's no one there to save it.
01:54:57:02,01:54:58:14,Then make the climb.
01:54:58:18,01:55:00:12,
01:55:03:15,01:55:04:23,How?
01:55:06:11,01:55:08:06,As the child did...
01:55:12:23,01:55:14:15,...without the rope.
01:55:17:07,01:55:19:14,Then fear will find you again.
01:55:26:14,01:55:28:20,"Ah, supplies for your journey?"
01:55:29:00,01:55:31:03,"Oh, that's wonderful. That's..."
01:55:33:15,01:55:35:09,
01:55:35:16,01:55:37:07,What does that mean?
01:55:37:20,01:55:39:02,Rise.
01:55:40:10,01:55:41:11,No.
01:56:02:02,01:56:03:18,
01:56:42:05,01:56:44:05,
01:57:11:10,01:57:13:08,"No, there's been a mistake!"
01:57:13:12,01:57:15:12,Take me to Bane!
01:57:18:02,01:57:19:18,I want to see Bane!
01:57:23:00,01:57:24:02,Order!
01:57:24:06,01:57:27:00,This is a mistake! Where is Bane?
01:57:27:04,01:57:29:07,"There's been no mistake, Mr. Stryver."
01:57:29:16,01:57:32:03,You are Philip Stryver...
01:57:32:06,01:57:35:19,...executive vice president of Daggett Industries...
01:57:35:23,01:57:39:14,...who for years has been living off the blood and sweat...
01:57:39:18,01:57:41:23,...of people less powerful than him.
01:57:42:03,01:57:45:05,Call Bane. I am one of you.
01:57:45:11,01:57:48:24,Bane has no authority here. This is merely a sentencing hearing.
01:57:49:04,01:57:51:07,"Now, the choice is yours."
01:57:51:11,01:57:53:21,Exile or death!
01:57:54:14,01:57:56:04,
01:57:58:12,01:57:59:22,Order!
01:58:00:12,01:58:01:19,Exi... Exile.
01:58:02:13,01:58:03:23,Sold.
01:58:04:03,01:58:05:21,To the man in the cold sweat.
01:58:13:06,01:58:14:17,You follow the thick ice.
01:58:14:20,01:58:16:24,"You try to swim, you're dead in minutes."
01:58:17:04,01:58:18:18,Has anyone made it?
01:58:32:04,01:58:34:14,Where are they? It's not like we have a lot of time.
01:58:35:01,01:58:36:04,How long?
01:58:36:08,01:58:38:04,The bomb goes off tomorrow.
01:58:38:14,01:58:41:14,- We have about 18 hours to do something. - To do what?
01:58:41:18,01:58:45:18,To mark the truck. Get a GPS on it so we can start to figure out how to bring it down.
01:58:52:11,01:58:53:17,That's it?
01:58:56:05,01:58:57:08,Foley.
01:58:58:21,01:59:02:19,"- Where's Foley, damn it? - You shouldn't be out on the streets."
01:59:07:12,01:59:10:10,"- Jim, he's not here. - You let your wife come to the door?"
01:59:10:14,01:59:13:15,"- When the city's under occupation? - Wait in the kitchen, honey."
01:59:13:19,01:59:16:10,"What did you do, bury your uniform in the backyard?"
01:59:16:14,01:59:18:17,You saw what they did to those Special Forces.
01:59:18:21,01:59:21:05,Have you forgotten all the years we were out on patrol?
01:59:21:09,01:59:24:12,When every gangbanger wanted to plant one as soon as our backs were turned?
01:59:24:16,01:59:28:19,That was different. These guys run the city. The government's done a deal with them.
01:59:28:23,01:59:31:12,Bane's got their balls in a vice. That's not a deal.
01:59:31:16,01:59:34:23,"You move on Bane, the triggerman is gonna hit the button."
01:59:35:03,01:59:39:03,You think he's given control of that bomb to one of the people?
01:59:39:06,01:59:41:07,You think this is part of some revolution?
01:59:41:11,01:59:44:07,There's one man with his finger on the button. That's Bane.
01:59:44:11,01:59:47:13,"Look, we've all got to keep our heads down till they can fix this."
01:59:47:17,01:59:51:08,#NAME?
01:59:51:12,01:59:53:02,...the city!
01:59:53:10,01:59:55:02,"Look, Peter."
01:59:56:01,02:00:00:15,"I'm not asking you to walk down Grand in your dress blues, but something has to be done."
02:00:00:19,02:00:02:20,#NAME?
02:00:03:00,02:00:05:04,What goods that gonna do when that thing blows?
02:00:05:08,02:00:07:19,You don't know that's gonna happen.
02:00:09:17,02:00:11:08,
02:00:11:23,02:00:14:06,"I hear you're looking for men, Commissioner."
02:00:14:10,02:00:15:16,How about me instead?
02:00:15:20,02:00:18:11,"Miss Tate, I, uh, can't ask you to do that."
02:00:19:09,02:00:20:11,Please.
02:00:22:01,02:00:24:05,You little punk! What'd you take?
02:00:24:09,02:00:26:16,Nothing! I didn't take anything!
02:00:26:20,02:00:30:03,"You steal from us, you little bastard?"
02:00:30:17,02:00:34:17,"Now, you boys know you can't come into my neighborhood without asking politely."
02:00:40:15,02:00:43:21,"Never steal anything from someone you can't outrun, kid."
02:00:50:13,02:00:52:14,You're pretty generous for a thief.
02:01:01:06,02:01:04:01,#NAME?
02:01:04:09,02:01:07:13,"- If you're expecting an apology, I... - It wouldn't suit you."
02:01:08:23,02:01:09:24,I need your help.
02:01:10:13,02:01:11:24,And why would I help you?
02:01:12:04,02:01:14:04,For this. Clean slate.
02:01:14:08,02:01:16:08,You'd trust me with that?
02:01:16:22,02:01:18:13,After what I did to you?
02:01:18:17,02:01:21:15,"I'll admit, I was a little let down."
02:01:23:06,02:01:26:09,"But I still think there's more to you. In fact, I think that for you..."
02:01:26:19,02:01:28:03,...this isn't just a tool.
02:01:28:07,02:01:31:12,It's an escape route. You want to disappear. Start fresh.
02:01:32:10,02:01:35:09,- I can't even get off this island. - I can give you a way off...
02:01:35:13,02:01:37:02,...once you get me to Lucius Fox.
02:01:37:06,02:01:40:01,Find out where they're holding him and take me in.
02:01:43:19,02:01:44:22,Why do you need Fox?
02:01:45:02,02:01:47:14,#NAME?
02:01:47:18,02:01:49:08,Maybe I like it this way.
02:01:49:12,02:01:51:03,Maybe you do...
02:01:52:12,02:01:54:20,...but tomorrow that bomb's going off.
02:01:57:10,02:01:59:03,Got your powerful friend on the case?
02:01:59:07,02:02:00:15,I'm trying...
02:02:01:11,02:02:03:02,...but I need Fox.
02:02:03:06,02:02:04:24,As it approaches...
02:02:05:19,02:02:06:23,...flip the switch.
02:02:07:03,02:02:10:16,"The needle hits 200, you give me the signal, I'll mark the truck. Okay?"
02:02:12:01,02:02:13:16,"Heads up, heads up."
02:02:29:19,02:02:32:02,- I got it. - Mercenaries on your 6.
02:02:32:06,02:02:35:09,Stand still! Keep your hands where we can see them!
02:02:37:14,02:02:39:15,"Commissioner Gordon, you are under arrest."
02:02:39:19,02:02:41:12,On whose authority?
02:02:41:16,02:02:42:21,The people of Gotham.
02:02:43:21,02:02:48:19,No lawyer? No witnesses? What sort of due process is this?
02:02:48:23,02:02:52:04,"Your guilt has been determined, this is merely a sentencing hearing."
02:02:52:14,02:02:54:04,"Now, what will it be?"
02:02:55:09,02:02:58:02,Death or exile?
02:02:58:06,02:03:03:00,"Crane, if you think we're going out onto that ice willingly..."
02:03:03:04,02:03:04:19,...you have another thing coming.
02:03:07:06,02:03:08:15,"Death, then."
02:03:08:18,02:03:10:24,#NAME?
02:03:11:04,02:03:12:16,Death...
02:03:13:24,02:03:15:17,...by exile.
02:03:15:21,02:03:17:14,
02:03:18:07,02:03:19:18,Bring her to me.
02:03:26:06,02:03:30:11,"Hey, we're going now. Blake says they're ready! Get your gear on!"
02:03:30:15,02:03:33:16,"Hey, you hear me? We're going now. Let's do it."
02:03:37:19,02:03:40:01,"Find this one a spot, got a big day tomorrow."
02:03:40:05,02:03:43:09,We all do. It's not every day you bag Bruce Wayne.
02:03:45:15,02:03:47:00,#NAME?
02:03:47:04,02:03:49:14,"Picked a hell of a time to go on vacation, Mr. Wayne."
02:03:49:17,02:03:51:10,How long until that core ignites?
02:03:51:14,02:03:55:10,- That bomb goes off in 12 hours. - Unless we can reconnect it to the reactor.
02:03:56:04,02:03:59:07,- Can you get Miranda out of here? - Not tonight. I'm sorry.
02:04:00:02,02:04:02:08,- Do what's necessary - Tonight I need you.
02:04:02:12,02:04:04:22,#NAME?
02:04:05:02,02:04:09:06,"Sorry to spoil things, boys, but Bane wants these guys to himself."
02:04:11:14,02:04:14:16,"- I won't forget about you, Miranda. - I know."
02:04:23:23,02:04:25:18,"I like your girlfriend, Mr. Wayne."
02:04:25:22,02:04:27:19,He should be so lucky.
02:04:33:13,02:04:36:07,Any move I make on Bane or the bomb...
02:04:36:11,02:04:38:08,...the triggerman sets it off.
02:04:38:12,02:04:41:07,"Well, they won't use radio or cell. Too much interference."
02:04:41:11,02:04:43:03,Infrared doesn't have the range.
02:04:43:07,02:04:46:01,It'll have to be a microburst. Longwave.
02:04:46:05,02:04:48:00,#NAME?
02:04:48:04,02:04:51:19,But I'll need the EMP cannon guidance mount from the Bat.
02:04:52:23,02:04:54:14,Remember where you parked?
02:05:08:23,02:05:10:11,She ﬂy okay?
02:05:11:11,02:05:14:05,"Yeah, even without the autopilot."
02:05:14:09,02:05:17:08,- Thanks. - Autopilot? That's what you're there for.
02:05:57:02,02:05:59:21,"Okay. It's clear. Come on, quick. One at a time."
02:06:02:08,02:06:03:10,
02:06:03:19,02:06:05:03,"Wait, wait!"
02:06:06:11,02:06:07:22,Ross!
02:06:08:02,02:06:09:11,Ross?
02:06:10:02,02:06:12:04,#NAME?
02:06:12:20,02:06:14:10,Get down!
02:06:16:01,02:06:17:07,Who are you?
02:06:46:17,02:06:47:24,Light it up.
02:07:05:23,02:07:09:03,#NAME?
02:07:19:13,02:07:21:06,Impossible.
02:07:22:01,02:07:23:19,Keep her close.
02:07:24:11,02:07:26:03,He'll come for her.
02:07:26:11,02:07:28:05,Where's Miranda Tate?
02:07:28:21,02:07:30:08,Bane took her.
02:07:30:13,02:07:33:20,"He's holed up at city hall, surrounded by his army."
02:07:34:03,02:07:36:15,This blocks the remote detonator signal to the bomb.
02:07:36:19,02:07:40:11,Get it onto it before sunrise. They might hit the button when it starts.
02:07:41:09,02:07:42:13,When what starts?
02:07:43:01,02:07:44:06,War.
02:07:58:01,02:07:59:06,
02:08:20:03,02:08:21:06,You missed a spot.
02:08:24:20,02:08:29:17,"- If you're working alone, wear a mask. - I'm not afraid to be seen standing up to them."
02:08:29:21,02:08:33:02,The mask is not for you. It's to protect the people you care about.
02:08:34:19,02:08:36:19,"Count to five, then throw."
02:08:36:22,02:08:38:19,
02:08:47:04,02:08:49:20,"No offense, but you got something bigger in that belt?"
02:09:00:06,02:09:03:09,#NAME?
02:09:03:13,02:09:05:19,But you need to get people across the bridge.
02:09:05:23,02:09:08:05,#NAME?
02:09:08:09,02:09:11:02,Lead an exodus. Save as many lives as you can.
02:09:11:06,02:09:12:13,You don't need me here?
02:09:12:17,02:09:14:06,You've given me an army.
02:09:14:10,02:09:15:14,Now go.
02:09:16:08,02:09:17:11,"Hey, thanks."
02:09:17:14,02:09:18:23,Don't thank me yet.
02:09:19:02,02:09:21:04,"Well, I might not get a chance later."
02:09:34:24,02:09:36:17,You shouldn't have.
02:09:37:16,02:09:39:20,The midtown tunnel's blocked by debris...
02:09:39:24,02:09:43:09,...but the cannons have enough firepower to make a path for people.
02:09:43:13,02:09:45:09,Wait until the fighting begins.
02:09:45:13,02:09:48:06,You're gonna wage a war to save your stuck-up girlfriend?
02:09:48:10,02:09:49:11,"To start it, throttle..."
02:09:49:15,02:09:51:02,
02:09:51:06,02:09:54:10,- I got it. - We have 45 minutes to save this city.
02:09:54:14,02:09:57:08,"No, I've got 45 minutes to get clear of the blast radius."
02:09:57:12,02:10:00:19,"- You don't stand a chance against these guys. - With your help, I might."
02:10:00:23,02:10:03:08,"I'll open that tunnel, then I'm gone."
02:10:04:10,02:10:06:01,There's more to you than that.
02:10:09:17,02:10:11:19,Sorry to keep letting you down.
02:10:15:11,02:10:16:24,Come with me.
02:10:18:07,02:10:19:21,Save yourself.
02:10:22:03,02:10:24:20,You don't owe these people any more.
02:10:24:24,02:10:27:03,You've given them everything.
02:10:27:07,02:10:28:18,Not everything.
02:10:29:04,02:10:30:10,Not yet.
02:11:10:11,02:11:12:03,Disperse!
02:11:12:07,02:11:14:12,Disperse or be fired upon!
02:11:15:22,02:11:18:07,There's only one police in this town.
02:11:18:23,02:11:20:20,
02:11:57:07,02:11:58:23,Open fire.
02:12:08:09,02:12:10:18,
02:12:50:04,02:12:51:22,- Here it comes! - Get ready!
02:13:21:18,02:13:25:21,So you came back to die with your city.
02:13:26:04,02:13:29:24,No. I came back to stop you.
02:13:41:01,02:13:42:02,Now!
02:13:55:00,02:13:56:15,That's impossible.
02:13:58:12,02:14:00:03,Cut over to Fifth!
02:14:14:04,02:14:16:05,Here you go. Get on the bus. Go ahead.
02:14:16:09,02:14:18:23,"You, come with me. You too."
02:14:19:04,02:14:22:05,"Hey, you, you, and you, come here, come here."
02:14:22:09,02:14:24:05,"Everyone else get on the bus, okay?"
02:14:24:09,02:14:27:01,"You guys, you go knock on doors and spread the word, okay?"
02:14:27:05,02:14:31:02,The bomb is gonna go off. Get out by the South Street tunnel or over the bridge.
02:14:31:06,02:14:33:23,"You do two blocks and you get back to the bus, all right?"
02:14:34:03,02:14:35:24,"Go, go, go!"
02:14:36:04,02:14:37:13,Is he back?
02:14:38:22,02:14:40:06,"Keep your eyes open. Go, go."
02:15:23:07,02:15:25:22,
02:15:44:14,02:15:46:02,
02:16:02:21,02:16:04:10,Cover the doors!
02:16:07:14,02:16:09:03,Where's your trigger?!
02:16:09:11,02:16:11:02,Where is it?!
02:16:12:00,02:16:14:21,You'd never give it to an ordinary citizen!
02:16:15:00,02:16:17:15,Where is it? Where's your trigger?
02:16:17:19,02:16:18:21,
02:16:19:00,02:16:21:18,Where is it?! Where is it?!
02:16:29:13,02:16:31:16,Tell me where the trigger is.
02:16:32:04,02:16:35:18,Then you have my permission to die.
02:16:47:21,02:16:49:14,I broke you.
02:16:50:21,02:16:52:18,How have you come back?
02:16:52:22,02:16:57:10,You think you're the only one who could learn the strength to escape?
02:16:57:14,02:16:58:21,Where's the trigger?
02:16:59:13,02:17:01:22,But I never escaped.
