Start Time,End Time,Subtitle
00:01:00:08,00:01:03:14,I knew Harvey Dent.
00:01:04:08,00:01:05:22,I was his friend.
00:01:08:03,00:01:14:06,And it will be a very long time before someone inspires us the way he did.
00:01:16:12,00:01:18:14,I believed in Harvey Dent.
00:01:37:14,00:01:40:11,"Dr. Pavel, I'm CIA."
00:01:40:14,00:01:41:16,He wasn't alone.
00:01:41:19,00:01:45:21,"- Uh, you don't get to bring friends. - They are not my friends."
00:01:46:01,00:01:48:01,"Don't worry, no charge for them."
00:01:48:07,00:01:51:24,#NAME?
00:01:52:06,00:01:53:20,They work for the mercenary.
00:01:54:09,00:01:55:21,The masked man.
00:01:56:13,00:01:58:22,#NAME?
00:01:59:15,00:02:01:16,Get them on board. I'll call it in.
00:02:10:06,00:02:12:14,The flight plan I just filed with the agency...
00:02:12:18,00:02:16:23,"...lists me, my men, Dr. Pavel here..."
00:02:17:03,00:02:19:09,...but only one of you!
00:02:21:22,00:02:26:16,First one to talk gets to stay on my aircraft!
00:02:33:14,00:02:37:06,Who paid you to grab Dr. Pavel?
00:02:39:18,00:02:41:03,
00:02:42:01,00:02:44:09,He didn't fly so good!
00:02:44:13,00:02:46:13,Who wants to try next?
00:02:47:12,00:02:49:03,Tell me about Bane!
00:02:49:07,00:02:50:19,Why does he wear the mask?
00:02:53:14,00:02:55:23,A lot of loyalty for a hired gun!
00:02:56:03,00:02:59:19,"Well, perhaps he's wondering why someone would shoot a man..."
00:02:59:23,00:03:03:02,...before throwing him out of a plane.
00:03:07:01,00:03:08:19,At least you can talk.
00:03:08:23,00:03:10:02,Who are you?
00:03:10:06,00:03:12:17,It doesn't matter who we are.
00:03:13:04,00:03:15:08,What matters is our plan.
00:03:21:16,00:03:25:02,No one cared who I was till I put on the mask.
00:03:26:16,00:03:28:16,"If I pull that off, will you die?"
00:03:28:20,00:03:31:00,It would be extremely painful.
00:03:31:07,00:03:32:08,You're a big guy.
00:03:32:12,00:03:33:17,For you.
00:03:37:15,00:03:39:21,Was getting caught part of your plan?
00:03:40:04,00:03:41:13,Of course.
00:03:46:12,00:03:50:01,Dr. Pavel refused our offer in favor of yours.
00:03:50:05,00:03:53:17,#NAME?
00:04:07:02,00:04:10:15,"Well, congratulations, you got yourself caught!"
00:04:10:19,00:04:14:05,- Sir? - Now what's the next step of your master plan?
00:04:15:02,00:04:16:19,Crashing this plane...
00:04:22:03,00:04:23:15,...with no survivors.
00:04:23:19,00:04:25:13,
00:04:46:24,00:04:48:01,"Mayday, Mayday!"
00:04:48:05,00:04:49:10,
00:04:55:13,00:04:57:04,
00:05:34:07,00:05:37:11,Aah! What you doing to me? Let me out!
00:05:40:12,00:05:41:19,No!
00:05:42:09,00:05:44:02,"No, no, no! No!"
00:05:51:05,00:05:52:23,
00:05:55:21,00:05:58:14,"No! They expect one of us in the wreckage, brother."
00:06:00:18,00:06:02:05,Have we started the fire?
00:06:02:11,00:06:05:23,"Yes, the fire rises."
00:06:07:15,00:06:09:09,
00:06:14:21,00:06:18:11,"Calm down, doctor. Now is not the time for fear."
00:06:19:04,00:06:20:20,That comes later.
00:06:47:12,00:06:51:06,Harvey Dent Day may not be our oldest public holiday...
00:06:51:10,00:06:54:11,...but we're here tonight because it's one of the most important.
00:06:54:15,00:06:58:18,Harvey Dent's uncompromising stand against organized crime...
00:06:58:22,00:07:03:01,"...had made Gotham a safer place than it was at the time of his death, eight years ago."
00:07:03:05,00:07:06:09,This city has seen a historic turnaround.
00:07:06:14,00:07:11:21,"No city is without crime, but this city is without organized crime because the Dent Act..."
00:07:12:01,00:07:15:07,...gave law enforcement teeth in its fight against the mob.
00:07:15:10,00:07:19:03,Now people are talking about repealing the Dent Act...
00:07:19:07,00:07:22:07,"...and to them I say, ""Not on my watch."""
00:07:22:11,00:07:23:15,
00:07:23:19,00:07:26:13,I want to thank the Wayne Foundation for hosting this event.
00:07:26:17,00:07:30:20,I'm told Mr. Wayne couldn't be here tonight. I'm sure he's with us in spirit.
00:07:30:24,00:07:33:18,And now I'm gonna give way to an important voice...
00:07:33:22,00:07:36:09,You ever lay eyes on Wayne at one of these things?
00:07:36:13,00:07:38:06,No one has. Not in years.
00:07:38:10,00:07:42:07,... people put their faith in a murderous thug in a mask and a cape.
00:07:42:11,00:07:46:00,A thug who showed his true nature...
00:07:46:04,00:07:48:15,...when he betrayed the trust of this great man...
00:07:49:17,00:07:51:07,...and murdered him in cold blood.
00:07:52:00,00:07:54:09,"Sweetheart, not so fast with the chow."
00:07:54:13,00:07:56:13,#NAME?
00:07:56:17,00:08:00:05,Jim Gordon can tell you the truth about Harvey Dent. I'll let him tell you himself.
00:08:00:09,00:08:01:20,Commissioner Gordon.
00:08:11:04,00:08:12:15,The truth?
00:08:17:12,00:08:18:20,I have...
00:08:20:03,00:08:21:18,...written a speech...
00:08:22:23,00:08:25:18,...telling the truth about Harvey Dent.
00:08:30:17,00:08:32:21,Maybe the time isn't right.
00:08:36:16,00:08:39:07,Maybe right now...
00:08:39:10,00:08:42:02,...all you need to know is that there are...
00:08:42:18,00:08:47:01,...1000 inmates in Blackgate Prison as a direct result of the Dent Act.
00:08:47:05,00:08:52:03,"These are violent criminals, essential cogs in the organized-crime machine."
00:08:52:08,00:08:57:05,"Maybe, for now, all I should say about the death of Harvey Dent is this:"
00:09:01:12,00:09:02:17,It has not been for nothing.
00:09:03:17,00:09:04:19,
00:09:04:23,00:09:07:17,#NAME?
00:09:07:21,00:09:10:20,- ...he never leaves the east wing. - I heard he had an accident.
00:09:11:00,00:09:14:18,"- Yeah, that he's disfigured. He has to wear a... - Mr. Till?"
00:09:15:01,00:09:18:16,Why are your people using the main staircase?
00:09:19:05,00:09:21:04,And where's Mrs. Bolton?
00:09:22:00,00:09:24:01,"Uh, she's at the bar, sir. Can I help?"
00:09:24:05,00:09:25:10,The east drawing room.
00:09:25:14,00:09:30:14,"Unlock the door, put the tray on the table, lock the door again. Nothing more."
00:09:34:15,00:09:36:24,"I'm sorry, Miss Tate. I tried, but he won't see you."
00:09:37:09,00:09:39:04,And you mustn't take it personally.
00:09:39:12,00:09:43:08,Everyone knows that Wayne's holed up in there with 8-inch nails...
00:09:43:12,00:09:45:04,...peeing into Mason jars.
00:09:45:08,00:09:47:17,It's very good of you to let me on the grounds.
00:10:00:01,00:10:03:10,Why are you wasting your time trying to talk to a man...
00:10:03:13,00:10:08:07,...who threw away your investment on some save-the-world vanity project?
00:10:08:11,00:10:10:17,He can't get your money back. I can.
00:10:11:12,00:10:15:21,"I could try explaining that a save-the-world project, vain or not..."
00:10:16:01,00:10:18:11,"...is worth investing in, Mr. Daggett."
00:10:18:15,00:10:21:19,But you understand only money and the power you think it buys...
00:10:21:24,00:10:24:22,...so why waste my time indeed?
00:10:25:11,00:10:26:23,Second shift reports in?
00:10:27:03,00:10:29:05,You should spend more time with the mayor.
00:10:29:09,00:10:31:06,"Well, that's your department."
00:10:32:06,00:10:34:01,Anyone shown him the crime stats?
00:10:34:05,00:10:37:12,"He goes by his gut and it bothers him, no matter what the numbers."
00:10:37:16,00:10:41:13,#NAME?
00:10:41:17,00:10:45:23,He'll have plenty of time for visits. The mayor's gonna dump him in the spring.
00:10:46:02,00:10:47:16,#NAME?
00:10:47:20,00:10:51:17,- But he's a hero. - A war hero. This is peacetime.
00:11:20:11,00:11:21:12,
00:11:21:20,00:11:25:05,"Oh, sorry, sorry. I'm so terribly sorry, Mr. Wayne."
00:11:27:16,00:11:29:09,"It is Mr. Wayne, isn't it?"
00:11:31:03,00:11:37:05,"Although you don't have the long nails or, heh, the facial scars, sir."
00:11:38:02,00:11:40:05,Is that what they say about me?
00:11:40:14,00:11:43:11,It's just that no one ever sees you.
00:11:43:23,00:11:47:20,That's a beautiful necklace. Reminds me of one that belonged to my mother.
00:11:47:24,00:11:51:02,It can't be the same one...
00:11:51:14,00:11:54:18,...because her pearls are in this safe...
00:11:56:01,00:11:59:02,...the manufacturer clearly explained...
00:12:01:21,00:12:03:15,...is uncrackable.
00:12:08:21,00:12:10:15,Oops.
00:12:10:19,00:12:12:24,Nobody told me it was uncrackable.
00:12:14:17,00:12:17:04,I'm afraid I can't let you take those.
00:12:17:19,00:12:21:07,"Look, you wouldn't beat up a woman any more than I would beat up a cripple."
00:12:22:20,00:12:26:04,"Of course, sometimes exceptions have to be made."
00:12:31:17,00:12:33:12,"Good night, Mr. Wayne."
00:12:48:16,00:12:50:01,Can I have a ride?
00:12:50:13,00:12:51:18,You read my mind.
00:12:52:13,00:12:54:02,Let's go.
00:12:55:02,00:12:56:21,Miss Tate was asking to see you again.
00:12:57:01,00:12:58:16,She's very persistent.
00:12:58:20,00:13:01:04,"And quite lovely, in case you were wondering."
00:13:01:08,00:13:03:12,- I wasn't. - What are you doing?
00:13:03:16,00:13:06:23,Examining print dust. We've been robbed.
00:13:07:03,00:13:10:02,"And this is your idea of, uh, sounding the alarm, is it?"
00:13:10:06,00:13:12:10,"She took the pearls, tracking device and all."
00:13:12:14,00:13:13:21,#NAME?
00:13:14:01,00:13:16:16,Perhaps you should stop letting them in this side of the house.
00:13:16:20,00:13:19:07,Perhaps you should start learning to make your own bed.
00:13:20:13,00:13:23:09,- Why were you dusting for prints? - I wasn't.
00:13:24:06,00:13:25:18,She was.
00:13:29:00,00:13:32:02,Sir. Congressman Gilly's wife has been calling in.
00:13:32:05,00:13:36:03,The congressman never made it home after the Wayne Foundation event.
00:13:36:19,00:13:38:11,That's a job for the police?
00:13:38:15,00:13:41:11,"When you and Dent cleaned the streets, you cleaned them good."
00:13:41:15,00:13:45:10,"Pretty soon we'll be chasing down, uh, overdue library books."
00:13:45:14,00:13:46:24,
00:13:47:04,00:13:51:08,"And yet here you are, like we're still at war."
00:13:53:07,00:13:55:13,"- What's your name, son? - Blake, sir."
00:13:55:17,00:13:57:12,You have something you want to ask me?
00:13:59:18,00:14:03:02,"It's about that night. This night, eight years ago. The night Dent died."
00:14:03:06,00:14:05:05,The last confirmed sighting of the Batman.
00:14:05:16,00:14:08:11,"He murders those people, takes down two SWAT teams..."
00:14:08:15,00:14:12:09,...breaks Dent's neck and then just vanishes?
00:14:12:20,00:14:15:05,"I'm not hearing a question, son."
00:14:15:09,00:14:17:08,Don't you want to know who he was?
00:14:18:05,00:14:20:15,I know exactly who he was.
00:14:22:19,00:14:24:14,He was the Batman.
00:14:25:05,00:14:26:15,
00:14:26:19,00:14:29:13,Let's go see about the congressman's wife.
00:14:38:09,00:14:39:20,Master Wayne?
00:14:41:15,00:14:43:14,Master Wayne?
00:15:14:11,00:15:16:20,You haven't been down here in a long time.
00:15:16:24,00:15:20:13,Trying to find out more about our jewel thief. I ran her prints.
00:15:20:19,00:15:22:12,Unless she's lost a lot of weight...
00:15:23:19,00:15:26:03,...she was wearing someone else's fingerprints.
00:15:26:07,00:15:27:10,She's good.
00:15:27:14,00:15:31:03,"She may be, but we have a trace on the necklace."
00:15:31:07,00:15:33:22,We do. I cross-referenced the address she went back to...
00:15:34:02,00:15:37:17,"...with police data on high-end B-and-E's, and, um..."
00:15:38:04,00:15:39:23,Selina Kyle.
00:15:40:03,00:15:44:23,"The databases are full of close-calls, tips from fences."
00:15:45:03,00:15:49:03,"She's good, but the ground is shrinking beneath her feet."
00:15:49:07,00:15:52:01,We should send the police before she fences the pearls.
00:15:52:05,00:15:54:10,She won't. She likes them too much.
00:15:54:14,00:15:56:09,And they weren't what she was after.
00:15:56:13,00:15:58:15,#NAME?
00:15:58:19,00:16:01:19,It was printer toner mixed with graphite on the safe.
00:16:01:23,00:16:04:13,It gives a good pull and it's untraceable.
00:16:04:17,00:16:07:13,Fascinating. You two should exchange notes over coffee.
00:16:07:17,00:16:10:00,You're trying to set me up with a jewel thief?
00:16:10:04,00:16:14:16,"At this point, I'd set you up with a chimpanzee, if it brought you back to the world."
00:16:14:19,00:16:17:01,There's nothing out there for me.
00:16:17:07,00:16:18:19,And that's the problem.
00:16:18:23,00:16:21:13,You hung up your cape and your cowl but you didn't move on.
00:16:21:17,00:16:23:24,You never went to find a life. To find someone.
00:16:24:04,00:16:25:13,Alfred...
00:16:26:13,00:16:28:08,...I did find someone.
00:16:28:12,00:16:29:22,"I know, and you lost them."
00:16:30:02,00:16:32:01,"But that's all part of living, sir."
00:16:32:05,00:16:36:08,"But you're not living, you're just waiting, hoping for things to go bad again."
00:16:36:13,00:16:38:00,Remember when you left Gotham?
00:16:38:04,00:16:41:04,"Before all this, before Batman?"
00:16:41:22,00:16:42:23,You were gone seven year.
00:16:43:03,00:16:47:17,"Seven years I waited, hoping that you wouldn't come back."
00:16:47:21,00:16:51:12,"Every year, I took a holiday. I went to Florence."
00:16:51:16,00:16:53:22,There's this café on the banks of the Arno.
00:16:54:02,00:16:57:08,Every fine evening I'd sit there and order a Fernet Branca.
00:16:58:04,00:17:00:10,I had this fantasy...
00:17:01:12,00:17:04:05,...that I would look across the tables...
00:17:04:21,00:17:08:08,"...and I'd see you there, with a wife."
00:17:08:13,00:17:10:08,Maybe a couple of kids.
00:17:12:10,00:17:16:07,"You wouldn't say anything to me, nor me to you."
00:17:17:14,00:17:21:07,But we'd both know that you'd made it.
00:17:22:05,00:17:23:19,That you were happy.
00:17:26:16,00:17:30:09,I never wanted you to come back to Gotham.
00:17:31:13,00:17:36:01,"I always knew there was nothing here for you, except pain and tragedy."
00:17:36:05,00:17:39:02,And I wanted something more for you than that.
00:17:44:03,00:17:45:11,I still do.
00:17:49:17,00:17:52:13,They wash up here a couple of times a month.
00:17:52:17,00:17:54:04,More when it gets colder.
00:17:54:08,00:17:56:07,"Homeless, sheltering in the tunnels."
00:17:57:23,00:18:02:02,"We pulled him from the basin, but other than that we didn't touch him."
00:18:04:11,00:18:06:02,- What? - Name's Jimmy.
00:18:06:06,00:18:07:16,He's from St. Swithin's.
00:18:08:07,00:18:12:05,It's the boys' home where I coach some ball.
00:18:15:00,00:18:16:17,Jimmy hadn't been around for months.
00:18:16:21,00:18:19:09,#NAME?
00:18:19:13,00:18:23:10,He aged out. We don't have the resources to keep boys on after 16.
00:18:23:13,00:18:25:16,I thought the Wayne Foundation gave money for that.
00:18:25:19,00:18:27:22,Not for the past couple of years.
00:18:28:02,00:18:31:22,"- He has a brother here, doesn't he? - Mark. I'll tell him."
00:18:32:02,00:18:35:02,"I'd like to, if that's all right."
00:18:36:05,00:18:38:07,You know what he was doing in the tunnels?
00:18:38:11,00:18:42:07,Lot of guys been going down the tunnels when they age out.
00:18:44:14,00:18:46:16,Say you can live down there.
00:18:47:08,00:18:48:21,Say there's work down there.
00:18:49:01,00:18:50:13,Work?
00:18:50:20,00:18:53:12,What kind of work are you gonna find in the sewers?
00:18:53:16,00:18:56:07,"More than you can find up here, I guess."
00:18:57:04,00:18:58:10,So you know about him?
00:18:58:14,00:18:59:20,Of course.
00:19:01:13,00:19:03:09,Do you think he's coming back?
00:19:05:13,00:19:06:21,I don't know.
00:19:20:14,00:19:22:06,You brought a date?
00:19:22:10,00:19:25:15,I like having someone around to open doors for me.
00:19:26:22,00:19:29:18,Right hand. No partials.
00:19:33:16,00:19:36:03,#NAME?
00:19:36:23,00:19:39:00,"Not so fast, handsome."
00:19:39:07,00:19:40:13,You got something for me?
00:19:42:03,00:19:43:15,"Ah, yes."
00:19:49:16,00:19:51:02,
00:19:53:05,00:19:56:08,I don't know what you're planning to do with Mr. Wayne's prints...
00:19:56:12,00:19:59:07,...but I'm guessing you'll need his thumb.
00:20:00:02,00:20:02:04,"You don't count so good, huh?"
00:20:02:08,00:20:03:14,I count fine.
00:20:03:24,00:20:07:04,"In fact, I'm counting to 10 right now."
00:20:09:15,00:20:10:16,Okay.
00:20:14:19,00:20:17:11,"My friend's outside. Just hit ""send."""
00:20:21:18,00:20:22:23,
00:20:29:05,00:20:30:14,This place is a little dead.
00:20:30:18,00:20:33:24,It'll liven up in a minute. Trust me.
00:20:35:14,00:20:36:17,Is everything okay?
00:20:36:21,00:20:38:21,Great. Catch you later.
00:20:42:07,00:20:43:09,
00:20:43:13,00:20:44:21,Hmm.
00:20:45:13,00:20:47:21,It would have been a lot easier...
00:20:48:08,00:20:50:06,...to just give me what we agreed.
00:20:50:11,00:20:52:20,We can't have loose ends.
00:20:53:02,00:20:56:20,"And even in that dress, no one's gonna miss you."
00:20:57:00,00:20:58:12,No.
00:20:58:16,00:21:00:13,But my friend over there?
00:21:00:17,00:21:03:21,Every cop in the city's missing him.
00:21:04:01,00:21:05:10,That's cute.
00:21:05:13,00:21:08:07,But they're not gonna be looking in a place like this.
00:21:08:14,00:21:11:08,I don't know. You did just use his cell phone.
00:21:14:13,00:21:16:09,
00:21:21:14,00:21:22:23,- Go! - Go!
00:21:39:06,00:21:40:22,Police! Get down now!
00:21:41:14,00:21:43:01,
00:21:44:05,00:21:45:08,Help me! Help me!
00:21:45:12,00:21:47:13,"Help me, please! Please help me!"
00:21:49:04,00:21:51:03,
00:21:51:06,00:21:52:23,
00:21:58:01,00:22:00:09,"Keep some pressure on that, sweetheart."
00:22:02:23,00:22:04:02,Call me?
00:22:07:02,00:22:09:08,"- You okay, miss? - He's bleeding. You gotta help him."
00:22:14:15,00:22:15:17,I got the congressman.
00:22:33:11,00:22:35:16,
00:22:44:16,00:22:45:23,Clear!
00:22:50:02,00:22:54:01,Manhole! Get this up! Get the DWP down here!
00:22:54:24,00:22:56:13,"You three, down with me."
00:22:56:17,00:23:00:03,"You two, you go down, cover the next exit!"
00:23:16:19,00:23:18:04,"What, they went down there?"
00:23:43:04,00:23:44:10,
00:23:49:14,00:23:52:18,"- We're gonna go down there, right? - That was a gas explosion, kid."
00:23:52:22,00:23:56:04,- Wasn't gas. It's a sewer. - No one goes in till we know what's there.
00:23:56:08,00:23:58:05,"We know, sir. The police commissioner."
00:23:58:08,00:24:00:05,Someone get this hothead out of here?
00:24:00:09,00:24:02:21,And where's that DWP guy?
00:24:45:12,00:24:47:11,Why are you here?
00:24:48:01,00:24:49:02,
00:24:49:06,00:24:50:19,Answer him.
00:24:52:11,00:24:54:09,I was asking you.
00:24:54:18,00:24:56:07,It's the police commissioner.
00:25:00:02,00:25:02:13,And you brought him down here?
00:25:03:05,00:25:05:19,- We didn't know what to do - You panicked.
00:25:06:08,00:25:09:07,And your weakness has cost the lives of three others.
00:25:09:11,00:25:10:14,"No, he's alone."
00:25:12:10,00:25:13:20,
00:25:14:11,00:25:16:00,Search him.
00:25:16:04,00:25:17:17,Then I will kill you.
00:25:37:17,00:25:39:07,
00:25:47:06,00:25:50:04,- He's dead - So show me his body.
00:25:50:08,00:25:53:18,The water runs to any one of the outflows. We'd never find him.
00:25:59:19,00:26:01:24,- Follow him! - Follow him?
00:26:02:03,00:26:03:05,
00:26:17:18,00:26:19:13,You okay? You okay?
00:26:19:17,00:26:21:15,"Hey, hey, you awake?"
00:26:21:19,00:26:23:08,
00:26:24:17,00:26:25:18,
00:26:28:06,00:26:29:21,I need to see Bruce Wayne.
00:26:30:01,00:26:32:12,"I'm sorry, Mr. Wayne doesn't take unscheduled calls."
00:26:32:16,00:26:34:11,Even from a police officer.
00:26:34:15,00:26:38:07,And if I go get a warrant for the investigation of Harvey Dent's murder?
00:26:38:11,00:26:40:17,That still count as unscheduled?
00:26:44:20,00:26:46:22,"What can I do for you, officer?"
00:26:47:06,00:26:49:08,Commissioner Gordon's been shot.
00:26:51:16,00:26:53:17,He chased a gunman down into the sewers.
00:26:53:21,00:26:57:05,"When I pulled him out, he was babbling about an underground army."
00:26:57:09,00:26:59:05,A masked man called Bane.
00:27:00:01,00:27:02:09,Shouldn't you be telling your superior officers?
00:27:02:13,00:27:05:15,They asked me if he saw any giant alligators.
00:27:06:02,00:27:07:19,He needs you.
00:27:09:09,00:27:10:16,He needs the Batman.
00:27:12:10,00:27:16:05,"- If Commissioner Gordon thinks... - Oh, he doesn't know or care who you are."
00:27:17:00,00:27:18:23,But we've met before.
00:27:20:02,00:27:24:05,"It was a long time ago. I was a kid. Uh, St. Swithin's."
00:27:24:21,00:27:28:15,It used to be funded by the Wayne Foundation. It's an orphanage.
00:27:29:14,00:27:33:17,"My mom died when I was small. It was a car accident, I don't really remember it."
00:27:34:08,00:27:39:12,But my dad got shot a couple years later over a gambling debt...
00:27:39:18,00:27:42:24,...and I remember that one just fine.
00:27:44:08,00:27:47:06,"Not a lot of people know what it feels like, do they?"
00:27:47:15,00:27:49:09,To be angry...
00:27:50:03,00:27:51:23,...in your bones.
00:27:54:12,00:27:56:16,"I mean, they understand."
00:27:57:06,00:27:58:16,Foster parents.
00:27:58:20,00:28:00:20,Everybody understands...
00:28:01:03,00:28:02:15,...for a while.
00:28:03:09,00:28:07:03,And then they want the angry little kid to do something he knows he can't do.
00:28:07:16,00:28:08:19,Move on.
00:28:09:08,00:28:11:08,"So after a while, they stop understanding."
00:28:11:12,00:28:13:09,They send the angry kid to a boys' home.
00:28:13:18,00:28:17:13,I figured it out too late. You gotta learn to hide the anger.
00:28:18:06,00:28:20:14,Practice smiling in a mirror.
00:28:22:10,00:28:23:22,It's like putting on a mask.
00:28:25:04,00:28:28:17,"So you showed up this one day, in a cool car."
00:28:28:21,00:28:30:17,Pretty girl on your arm.
00:28:31:19,00:28:33:14,We were so excited.
00:28:33:21,00:28:36:11,"Bruce Wayne, billionaire orphan."
00:28:36:22,00:28:40:16,"I mean, we used to make up stories about you, man. Legends."
00:28:40:20,00:28:44:15,"And, you know, with the other kids, that's all it was, just stories, but..."
00:28:46:06,00:28:48:12,"Right when I saw you, I knew who you really were."
00:28:49:23,00:28:52:19,I'd seen that look on your face before.
00:28:53:20,00:28:55:23,It's the same one I taught myself.
00:28:57:22,00:29:00:19,I don't know why you took the fall for Dent's murder...
00:29:01:16,00:29:03:17,...but I'm still a believer in the Batman...
00:29:04:13,00:29:06:05,...even if you're not.
00:29:08:22,00:29:13:20,Why did you say that your boys' home used to be funded by the Wayne Foundation?
00:29:14:00,00:29:15:18,Because the money stopped.
00:29:15:22,00:29:20:03,Might be time to get some fresh air. Start paying attention to the details.
00:29:21:00,00:29:23:09,Some of those details might need your help.
00:29:25:04,00:29:26:13,You check that name? Bane?
00:29:26:16,00:29:29:09,He's a mercenary. No other known names.
00:29:29:12,00:29:31:24,Him and his men were behind a coup in West Africa...
00:29:32:03,00:29:36:16,...that secured mining operations for our friend John Daggett.
00:29:37:09,00:29:40:04,- Now Daggett's brought them here. - Or so it seems.
00:29:42:06,00:29:44:09,- I'll keep digging. - Yeah.
00:29:45:14,00:29:51:19,"Alfred, why did the Wayne Foundation stop funding boys' homes in the city?"
00:29:51:23,00:29:57:01,The foundation is funded by the profits of Wayne Enterprises.
00:29:57:09,00:29:58:22,There have to be some.
00:29:59:02,00:30:02:10,"- Time to talk to Mr. Fox, I think. - I'll get him on the phone."
00:30:02:14,00:30:06:14,"No, no, no. Do we still have any cars around the place?"
00:30:06:18,00:30:08:15,Yes. One or two.
00:30:08:19,00:30:10:19,I need an appointment at the hospital for my leg.
00:30:10:23,00:30:13:17,- Which hospital? - Whichever one Jim Gordon's in.
00:30:18:03,00:30:20:22,- I have seen worse cartilage in knees - That's good.
00:30:21:02,00:30:23:14,No. That's because there is no cartilage in your knee.
00:30:23:18,00:30:27:02,And not much of any use in your elbows or your shoulders.
00:30:27:06,00:30:29:15,Between that and the scar tissue on your kidneys...
00:30:29:19,00:30:32:11,...the residual concussive damage to your brain tissue...
00:30:32:15,00:30:35:07,...and the general scarred-over quality of your body...
00:30:35:11,00:30:38:09,...I cannot recommend that you go heli-skiing. - Right.
00:30:53:20,00:30:56:09,We were in this together...
00:30:58:12,00:31:00:01,...then you were gone.
00:31:00:05,00:31:02:08,The Batman wasn't needed any more.
00:31:02:12,00:31:05:15,#NAME?
00:31:07:02,00:31:13:03,And now there's evil rising from where we tried to bury it.
00:31:13:08,00:31:17:19,The Batman has to come back.
00:31:17:23,00:31:20:10,What if he doesn't exist any more?
00:31:20:14,00:31:24:01,He must.
00:31:37:18,00:31:39:15,"You took my goddamn wallet, didn't you?"
00:31:39:19,00:31:42:16,"- You f... You took my wallet! - No, I..."
00:31:43:09,00:31:45:14,- Get out - She took my... Ah!
00:31:45:18,00:31:48:08,- Now! - Creep!
00:31:48:12,00:31:51:10,I don't know what he's so upset about. There's only 60 bucks in here.
00:31:51:14,00:31:53:08,Probably the watch.
00:31:53:18,00:31:55:08,
00:32:05:00,00:32:06:15,
00:32:08:14,00:32:09:15,Who's that?
00:32:09:19,00:32:11:22,A stiff can barely climb out of his sports car.
00:32:12:02,00:32:14:05,"- No, that's Bruce Wayne! - Mr. Wayne, over here!"
00:32:14:09,00:32:15:19,
00:32:15:23,00:32:18:05,
00:32:19:06,00:32:21:16,- I'm not sure if my assistant... - Right through here.
00:32:21:20,00:32:23:08,Thank you so much.
00:32:23:14,00:32:25:16,
00:32:28:14,00:32:32:09,Bruce Wayne at a charity ball.
00:32:33:10,00:32:35:07,"Miss Tate, isn't it?"
00:32:36:07,00:32:39:08,"Even before you became a recluse, you never came to these things."
00:32:39:19,00:32:43:04,The proceeds go to the big fat spread. It's not about charity.
